<?xml version="1.0" encoding="UTF-8"?>

<map-description xmlns:xsi="http://www.w3.org/2001/XMLSchema-instance"
	               xsi:noNamespaceSchemaLocation='map-info.xsd'>
  <expansions>
    <expansion id="12 o'clock">
      <position x="2720" y="240"/>
    </expansion>
    <expansion id="12 oclock' natural">
      <position x="1600" y="272"/>
    </expansion>
    <expansion id="9 o'clock">
      <position x="320" y="2768"/>
    </expansion>
    <expansion id="9 o'clock natural">
      <position x="288" y="1872"/>
    </expansion>
    <expansion id="6 o'clock">
      <position x="1408" y="3856"/>
    </expansion>
    <expansion id="6 o'clock natural">
      <position x="2464" y="3824"/>
    </expansion>
    <expansion id="3 o'clock">
      <position x="3776" y="1328"/>
    </expansion>
    <expansion id="3 o'clock natural">
      <position x="3808" y="2160"/>
    </expansion>
    <expansion id="top-left">
      <position x="288" y="240"/>
    </expansion>
    <expansion id="bottom-right">
      <position x="3808" y="3824"/>
    </expansion>
  </expansions>
  <starting-positions>
    <starting-position expansion-id="3 o'clock">
      <standard-building-placement>
        <non-producting-3x2>
          <position x="97" y="0"/>
          <position x="94" y="0"/>
          <position x="97" y="2"/>
          <position x="94" y="2"/>
          <position x="99" y="4"/>
          <position x="96" y="4"/>
        </non-producting-3x2>
      </standard-building-placement>
    </starting-position>
    <starting-position expansion-id="6 o'clock" >
      <standard-building-placement>
        <non-producting-3x2>
          <position x="125" y="25"/>
          <position x="125" y="27"/>
          <position x="125" y="29"/>
          <position x="122" y="25"/>
          <position x="122" y="27"/>
          <position x="122" y="29"/>
        </non-producting-3x2>
      </standard-building-placement>
    </starting-position>
    <starting-position expansion-id="9 o'clock" >
      <standard-building-placement>
        <non-producting-3x2>
          <position x="0" y="101"/>
          <position x="0" y="99"/>
          <position x="0" y="97"/>
          <position x="3" y="101"/>
          <position x="3" y="99"/>
          <position x="3" y="97"/>
        </non-producting-3x2>
      </standard-building-placement>
    </starting-position>
    <starting-position expansion-id="12 o'clock">
     <standard-building-placement>
        <non-producting-3x2>
          <position x="26" y="122"/>
          <position x="26" y="120"/>
          <position x="26" y="118"/>
          <position x="29" y="122"/>
          <position x="29" y="120"/>
          <position x="29" y="118"/>
        </non-producting-3x2>
      </standard-building-placement>
    </starting-position>
  </starting-positions>
</map-description>